id_lk;nama;slug;wilayah_upt;alamat;provinsi;kota_kab;kelurahan;kecamatan;kode_pos;bentuk_lk;legalitas_perizinan;tahun_izin;link_sk;nilai_akreditasi;tahun_akreditasi;nomor_tanggal_surat;pengelola;nama_pimpinan;izin_perolehan_tsl;pks_dengan_lk_lain
58;PT. Safari Lagoi Bintan;pt._safari_lagoi_bintan;Kepulauan Riau;Jl. Panglima Pantar, Lagoi Bintan Resort, Prov. Kepri;Kepulauan Riau;Kabupaten Bintan;Kota Baru;Teluk Sebong;;Taman safari;Keputusan Kepala BKPM No.1/1/ILK/PMDN/2015 tanggal 27 Februari 2016;2016;https://drive.google.com/file/d/14MWDDb9uzoE-_cibYroiGuiOLrMJBdr5/view?usp=drive_link;;;;Swasta;;;
59;PT. Samarinda Golden Prima;pt._samarinda_golden_prima;Kalimantan Timur;Jalan Danau Toba Nomor 11 A, Kelurahan Simpang Pasir, Kecamatan Palaran, Kota Samarinda, Provinsi Kalimantan Timur;Kalimantan Timur;Kota Samarinda;Simpang Pasir;Palaran;;Taman Satwa;Keputusan Menteri Kehutanan No.692/Menhut-II/2010 tanggal 15 Desember 2010;2010;https://drive.google.com/file/d/11w_pY8D0c2VcnygtpmKFbB95bpS74j-Z/view?usp=drive_link;;;;Swasta;;;
60;PT. Satwa Gunung Bayan Lestari;pt._satwa_gunung_bayan_lestari;Kalimantan Timur;Desa Umaq Dian, Kecamatan Tabang, Kabupaten Kutai Kartanegara, Provinsi Kalimantan Timur;Kalimantan Timur;Kabupaten Kutai Kartanegara;Umaq Dian;Tabang;;Taman Satwa;Keputusan Menteri Kehutanan No.360/Menhut-II/2009 tanggal 22 Juni 2009 jo Keputusan Menteri LHK No.1029/Menlhk/Setjen/KSA.2/12/2019 tanggal 3 Desember 2019;2009;https://drive.google.com/file/d/1CbXjW_2Es_4RZyln8ogt0atonm5_kZM4/view?usp=drive_link;B;2023;S.1410/KSDAE/KKHSG/KSA.2/12/2024 tanggal 27 Desember 2023;Swasta;;;
61;PT. Segara Alunan Bayu Ayu (SABA/Balitofia and Flamingo Beach Club Gianyar));pt._segara_alunan_bayu_ayu_(saba/balitofia_and_flamingo_beach_club_gianyar));Bali;Jl. Pantai Saba, Pering, Kec. Blahbatuh, Kabupaten Gianyar, Bali;Bali;Kabupaten Gianyar;Pering;Blahbatuh;;Taman satwa;Keputusan Menteri LHK No.86/Menlhk/Setjen/KSA.2/2/2020 tanggal 4 Februari 2020;2020;https://drive.google.com/file/d/11zKDPWLuF95QeqiqIMNjmQnecmLng4Iw/view?usp=drive_link;;;;Swasta;;;
62;PT. Suaka Alam Satwa;pt._suaka_alam_satwa;Jawa Barat;Desa Cibereum RT 01 RW 09, Kec. Cisarua, Kab. Bogor;Jawa Barat;Kabupaten Bogor;Cibereum;Cisarua;;Taman Satwa;Keputusan Kepala BKPM a.n Menteri LHK No.20/1/KLHK/2020 tanggal 30 Maret 2020;2020;https://drive.google.com/file/d/1C4QHsWP5b-bqYaXn4gwVUgN8uIk7YhkH/view?usp=drive_link;;;;Swasta;;;
63;PT. Taman Benoa Eksotik;pt._taman_benoa_eksotik;Bali;Banjar Pesanggaran, Kelurahan/Desa Pedungan, Kecamatan Denpasar Selatan, Kota Denpasar;Bali;Kota Denpasar;Pedungan;Denpasar Selatan;;Taman Satwa;Keputusan Menteri LHK No.505/Menlhk/Setjen/KSA.2/8/2019 tanggal 1 Agustus 2019;2019;https://drive.google.com/file/d/14X09N5A-EVScKc_Fwd6tKd6jJuUdLGas/view?usp=drive_link;B ;2022;S.1505/KSDAE/KKHSG/KSA.2/12/2022 tanggal 30 Desember 2022;Swasta;;;
64;PT. Taman Burung Citra Bali Internasional (Bali Bird Park);pt._taman_burung_citra_bali_internasional_(bali_bird_park);Bali;Jalan Serma Cok Ngurah Gambir Singapadu, Batubulan, Kec. Sukawati, Kabupaten Gianyar, Bali;Bali;Kabupaten Gianyar;Singapadu;Sukawati;;Taman Satwa Khusus;Keputusan Menteri Kehutanan No.97/Menhut-II/2006 tanggal 11 April 2006 Keputusan Menteri Kehutanan Nomor: SK.323/Menhut II/2014 tanggal 27 Maret 2014;2006;https://drive.google.com/file/d/125dTHw-nlRdd_QErDl-qx5zfhvzFVpJV/view?usp=drive_link;B ;2022;S.1504/KSDAE/KKHSG/KSA.2/12/2022 tanggal 30 Desember 2022;Swasta;;;
65;PT. Taman Impian Jaya Ancol;pt._taman_impian_jaya_ancol;DKI Jakarta;Jalan Lodan Timur Nomor 7, Ancol, Jakarta Utara 14430;DKI Jakarta;Kota Jakarta Utara;Ancol;Pademangan;;Taman Satwa;Keputusan Menteri Kehutanan No.405/Menhut-II/2004 tanggal 18 Oktober 2004;2004;https://drive.google.com/file/d/127ByF25HidmQoGMnK-0urtmB6XznlIVf/view?usp=drive_link;A;2011;;Swasta;;;
66;PT. Taman Safari Indonesia IV (Batang Dolphin Center);pt._taman_safari_indonesia_iv_(batang_dolphin_center);Jawa Tengah;Pantai Sigandu, Desa Klidang Lor, Kec.Batang, Kab. Batang;Jawa Tengah;Kabupaten Batang;Klidang Lor;Batang;;Taman Satwa;Keputusan Menteri Kehutanan No.665/Menhut-II/2011 tanggal 24 November 2011;2011;https://drive.google.com/file/d/128s5qZ3VbGEgDO-ZvSNoTns9H3Dq7lf_/view?usp=drive_link;B ;2013;;Swasta;;;
67;PT. Taman Safari Indonesia I Cisarua;pt._taman_safari_indonesia_i_cisarua;Jawa Barat;Jl. Kapten Harun Kabir No.724, Cisarua - Bogor 16750;Jawa Barat;Kabupaten Bogor;Cibereum;Cisarua;;Kebun Binatang;Keputusan Menteri Kehutanan dan Perkebunan No.242/kpts-II/1999 tanggal 27 April 1999;1999;https://drive.google.com/file/d/12BguCAhrkY3vbIo3ImPYUz7m58vcaAFV/view?usp=sharing;A;2011;;Swasta;Frans Manansang;Keputusan Kepala BBKSDA Jawa Barat Nomor SK.43/K.1/BIDTEK.1/KSA/01/2023 tanggal 13 Januari 2023 tentang Izin Perolehan Spesimen Satwa Liar Yang Tidak Dilindungi Undang-Undang Untuk Lembaga Konservasi Kepada PT. Taman Safari Indonesia di Kecamatan Cisarua, Kabupaten Bogor, provinsi Jawa Barat;Perjanjian Kerja Sama Antara Taman Margasatwa Ragunan dengan Lembaga Konservasi Taman Safari Indonesia Nomor 1831/-1.854 dan Nomor 03/SPK-LKTSI/XXXV-XI/2021 tanggal 18 November 2021 mengenai Program Kerjasama Hibah Satwa
68;PT. Taman Safari Indonesia II (TSI Prigen);pt._taman_safari_indonesia_ii_(tsi_prigen);Jawa Timur ;Desa Jatiarjo, Kecamatan Prigen, Kab. Pasuruan, Jawa Timur | (0343) 7735000;Jawa Timur ;Kabupaten Pasuruan;Jatiarjo;Prigen;;Taman Safari;Keputusan Menteri Kehutanan No.243/Menhut-II/2007 tanggal 19 Juli 2007;2007;https://drive.google.com/file/d/12GIWXwKMYXOEYVa6N7tk-J4EEseS6NGN/view?usp=drive_link;A;2012;;Swasta;Lies Lies Yuwati, S.Par,. CHA., CHIA;;
69;PT. Taman Safari Indonesia III (Bali Safari and Marine Park);pt._taman_safari_indonesia_iii_(bali_safari_and_marine_park);Bali;Jalan Bypass Prof. Dr. Ida Bagus Mantra, Ds. Serongga, Kec. Gianyar, Kab. Gianyar, Prov. Bali;Bali;Kabupaten Gianyar;Serongga;Gianyar;;Taman Satwa;Keputusan Menteri Kehutanan No.38/Menhut-II/2008 tanggal 20 Februari 2008;2008;https://drive.google.com/file/d/12HslCKdSCbzUBTYE6wtB-jabYO7_LgnR/view?usp=drive_link;A;2011;;Swasta;Marcel Driessen;;
70;PT. Taman Satwa Semarang;pt._taman_satwa_semarang;Jawa Tengah;Jl. Urip Sumoharjo RW 001 Kelurahan Wonosari Kecamatan Ngaliyan Kota Semarang;Jawa Tengah;Kota Semarang;Wonosari;Ngaliyan;;Taman Satwa;Keputusan Kepala BKPM a.n Menteri LHK No.19/1/KLHK/2010 tanggal 24 Maret 2020;2020;https://drive.google.com/file/d/1Xpe_dnWpZLdU6klRRkMlJFQ0qXEJeqYY/view?usp=drive_link;;;;Swasta;;;
71;PT. Taman Sengkaling Indah;pt._taman_sengkaling_indah;Jawa Timur ;Jl. Raya Mulyo Agung nomor 188, Sengkaling Kec. Dau, Kab. Malang 65151 Telp. (0341) 462260, 463309, Fax. (0341) 463309;Jawa Timur ;Kabupaten Malang;Mulyoagung;Dau;;Kebun Binatang;Keputusan Kepala BKPM No.1/1/ILK-PB/PMDN/2017 tanggal 30 Januari 2017;2017;https://drive.google.com/file/d/14OK4xHejlsO8ub7Td9CkrPWTGHF7rD8e/view?usp=drive_link;;;;Swasta;;;
72;PT. Unitwin Indonesia (Taman Hewan Pematang Siantar);pt._unitwin_indonesia_(taman_hewan_pematang_siantar);Sumatera Utara;Jalan Kapten M.H Sitorus No.10, Kabupaten Pematang Siantar, Sumatera Utara;Sumatera Utara;Kabupaten Pematang Siantar;Timbang-galung;Siantar Barat;;Taman Satwa;Keputusan Menteri Kehutanan No.84/Menhut-II/2007 tanggal 15 Maret 2007;2007;https://drive.google.com/file/d/12PeK0uG4WszbEIQl422_iixlJLJJvQuZ/view?usp=drive_link;B;2011;;Swasta;;;
73;PT. Wersut Seguni Indonesia;pt._wersut_seguni_indonesia;Jawa Tengah;Ds. Sendang Sikucing, Kec. Rowosari Kendal Telp. (0294) 3645623;Jawa Tengah;Kabupaten Kendal;Sendang Sikucing;Rowosari;;Taman Satwa;Keputusan Menteri Kehutanan No.393/Menhut-II/2011 tanggal 21 Juli 2011;2011;https://drive.google.com/file/d/12jQsnE2ftDiwIiWUZNYjT9tIg_FOWG4H/view?usp=drive_link;B;2013;;Swasta;;;
74;PT. Wisata Sapta Pesona;pt._wisata_sapta_pesona;Jawa Barat;Jln. Raya Puncak RT.003 RW.004, Desa Cipayung Girang, Kecamatan Megamendung, Kabupaten Bogor, Provinsi Jawa Barat;Jawa Barat;Kabupaten Bogor;Cipayung Girang;Megamendung;;Taman Satwa;Perizinan Berusaha Berbasis Risiko Nomor 02200072101430002 tanggal 27 Maret 2023;2023;https://drive.google.com/file/d/13F-rQEnEnSITOtKObqiXvGKKgwDP2JaH/view?usp=drive_link;;;;Swasta;Wenzel Sutantio;;
75;PT. Wisatareksa Gajah Perdana (Taro Elephant Safari Park);pt._wisatareksa_gajah_perdana_(taro_elephant_safari_park);Bali;Desa Taro, Ubud, Kabupaten Gianyar, Bali;Bali;Kabupaten Gianyar;Taro;Ubud;;Taman Satwa Khusus;Keputusan Menteri Kehutanan No.276/Menhut-II/2004 tanggal 2 Agustus 2004;2004;https://drive.google.com/file/d/12uApDFWvVExSSMj3TvbC_0kTgOtWq6sD/view?usp=drive_link;B;2011;;Swasta;;;
76;UPT. Informasi dan Pendidikan Lingkungan Hidup,  BLH Probolinggo (TWSL Probolinggo);upt._informasi_dan_pendidikan_lingkungan_hidup,__blh_probolinggo_(twsl_probolinggo);Jawa Timur ;Jl. Basuki Rahmat No.62, Kota Probolinggo, Provinsi Jawa Timur;Jawa Timur ;Kota Probolinggo;Mangunharjo;Mayangan;;Taman Satwa;Keputusan Menteri Kehutanan No.527/Menhut-II/2010 tanggal 27 September 2010;2010;https://drive.google.com/file/d/12uBokjpq8d9aU-Dj_gWMMw5kBF5r7zpM/view?usp=drive_link;;;;Pemda;;;
77;UPTD. Wahana Wisata Sawahlunto (Kandi Sawahlunto);uptd._wahana_wisata_sawahlunto_(kandi_sawahlunto);Sumatera Barat;Jl. Dt. Nan Sambilan, Kolok NanTuo, Barangin, Sijantang Koto, Talawi, Sawahlunto, Sumatera Barat. 27427, Indonesia.;Sumatera Barat;Kota Sawahlunto;Kolok Nan Tuo;Barangin;27427;Taman Satwa;Keputusan Menteri Kehutanan No.168/Menhut-II/2010 tanggal 1 April 2010;2010;https://drive.google.com/file/d/12Ts8iZTh6RbzzKyKGOa_PxAujX3UUbK7/view?usp=drive_link;B;2012;;Pemda;;;
78;"Yayasan ""Rahmat"" International Wildlife Museum and Gallery (Museum Rahmat Gallery)";"yayasan_""rahmat""_international_wildlife_museum_and_gallery_(museum_rahmat_gallery)";Sumatera Utara;Jl. S. Parman No. 309 Kel. Petisah Hulu  Kec. Medan Baru Kota Medan  Sumatera Utara 20152;Sumatera Utara;Kota Medan;Petisah Hulu;Medan Baru;;Museum Zoologi;Keputusan Menteri Kehutanan No.524/Kpts-II/2006 tanggal 30 November 2006;2006;https://drive.google.com/file/d/12v70EjPkccssCOwHrrzHHZODgjqN2Cij/view?usp=drive_link;B;2011;;Swasta;;;
79;Yayasan Bina Wisata dan Margasatwa Kasang Kulim Riau;yayasan_bina_wisata_dan_margasatwa_kasang_kulim_riau;Riau;Jl. H.Usman No.01, Kubang Jaya Kab. Kampar Prov. Riau;Riau;Kabupaten Kampar;Kubang Jaya;Siak Hulu;;Kebun Binatang;Keputusan Menteri Kehutanan dan Perkebunan No.250/Kpts-II/1999 Tanggal 28 April 1999;1999;https://drive.google.com/file/d/12zPlrqaRl22s6u6Acw-mQwTeVTZracVx/view?usp=drive_link;;;;Swasta;;;
80;Yayasan Lembaga Konservasi Flora dan Fauna Jhonlin Lestari;yayasan_lembaga_konservasi_flora_dan_fauna_jhonlin_lestari;Kalimantan Selatan;Jl. Kodeco Raya KM. 2 Desa Gunung Antasari Kecamatan Simpang Empat Kabupaten Tanah Bumbu;Kalimantan Selatan;Kabupaten Tanah Bumbu;Gunung Antasari;Simpang Empat;;Taman Satwa;Keputusan Menteri Kehutanan No.729/Menhut-II/2011 tanggal 21 Desember 2011;2011;https://drive.google.com/file/d/13-27oiB1mmyjmbUFdMGkBueX4Zs2373l/view?usp=drive_link;;;;Swasta;;;
81;Yayasan Mardi Wiyata;yayasan_mardi_wiyata;Jawa Timur ;Jalan Karang Widoro No.7, Karangwidoro, Dau, Malang, Jawa Timur 65146;Jawa Timur ;Kabupaten Malang;Karangwidoro;Dau;;Museum Zoologi;Keputusan Menteri Kehutanan No.526/Menhut-II/2006 tanggal 30 November 2006;2006;https://drive.google.com/file/d/132YhkBObi5EEdhcjidStpTZKJIe2gdJh/view?usp=drive_link;;;;Swasta;;;
82;Yayasan Margasatwa Tamansari Bandung Zoological Garden (Bandung Zoo);yayasan_margasatwa_tamansari_bandung_zoological_garden_(bandung_zoo);Jawa Barat;Jl. Kebun Binatang No 6, Siliwangi, Kecamatan Coblong, Kota Bandung, Jawa Barat 40132;Jawa Barat;Kota Bandung;Lebak Siliwangi;Coblong;40132;Kebun Binatang;Keputusan Menteri Kehutanan No.357/Kpts-II/2003 tanggal 27 Oktober 2003;2003;https://drive.google.com/file/d/137590Tk2EmELdkSXp1Ns1apba36n__Oq/view?usp=drive_link;B;2011;;Swasta;;;
83;PT. Aviary Jaya Lestari;pt._aviary_jaya_lestari;Banten;Kebayoran Arcade 5 F3 No 9, Jl. Boulevard Bintaro Jaya Sektor 7, Desa/Kelurahan Pondok Jaya, Kec. Pondok Aren, Tangerang Selatan, Banten Bintaro Creative Village Bintaro Jaya Sektor 3A, Pondok Ranji, Tangerang Selatan;Banten;Kota Tangerang Selatan;Pondok Jaya;Pondok Aren;;Taman Satwa;Perizinan Berusaha Berbasis Risiko Nomor 12450006238540008 tanggal 19 Maret 2024;2024;https://drive.google.com/file/d/1Ny4TfjwNjbo-c6uU_Pek1HS3my4GBFG-/view?usp=drive_link;;;;Swasta;;;
84;PT. Jaya Multi Zaman;pt._jaya_multi_zaman;Jawa Timur ;Jl. Brawijaya Komplek Redjo Agung, Desa/Kelurahan Mangil, Kec. Kaliwates, Kab. Jember, Provinsi Jawa Timur;Jawa Timur ;Kabupaten Jember;Mangil;Kaliwates;;Taman Satwa;Perizinan Berusaha Berbasis Risiko Nomor 1239000303410003 tanggal 11 Juni 2024;2024;https://drive.google.com/file/d/1Xianfw6dr0O9nvsagtX9MOwCcjjg9Zvg/view?usp=drive_link;;;;Swasta;;;
85;PT. Pantai Indah Batu Bedaun;pt._pantai_indah_batu_bedaun;Kepulauan Bangka Belitung;Kantor: Jalan Batu Bedaun, Kab. Bangka, Provinsi Kepulauan Bangka Belitung LK: Jl. Kampung Kualo, Kel. Matras, Kec. Sungailiat, Kab. Bangka, Provinsi Kepulauan Bangka Bleitung;Kepulauan Bangka Belitung;Kabupaten Bangka;Matras;Sungailiat;;Taman Satwa;Perizinan Berusaha Berbasis Risiko Nomor 81200142709460004 tanggal 6 September 2024;2024;https://drive.google.com/file/d/1CCMvm5APNGI3ZtkXSpICbDY5g2j2iI4j/view?usp=drive_link;;;;Swasta;;;
